{
  "id": "tweaks.adb",
  "name": "ADB over Wi-Fi",
  "summary": "Lets a computer on the car's Wi-Fi control the head unit",
  "description": "Adds a switch to Tweaks for ADB over the car's Wi-Fi, kept in step with Engineering Mode's ADB switch. Warning: there is no password, so anyone on the car's Wi-Fi can control the head unit. Needs Tweaks.",
  "author": "hazptr",
  "homepage": "https://github.com/cabinwright/tweaks-adb",
  "category": "tools",
  "versions": [
    {
      "version": "1.1",
      "url": "https://github.com/cabinwright/tweaks-adb/releases/download/v1.1/tweaks.adb-v1.1.zip",
      "sha256": "26615db1b6d0e3e712255c904fb78033bbd6a12ac875e744257c6e845a810bc0",
      "firmware": [
        "CVEV.USA.0000.V015.012.260507"
      ],
      "requires": [
        "cabinwright.tweaks>=1.4"
      ],
      "notes": "Works with the new Tweaks (cabinwright.tweaks)."
    },
    {
      "version": "1.0",
      "url": "https://github.com/cabinwright/tweaks-adb/releases/download/v1.0/tweaks.adb-v1.0.zip",
      "sha256": "35099777c33b12673a687a09547adccc0b66b0e19d674697a8b9bbda245401cd",
      "firmware": [
        "CVEV.USA.0000.V015.012.260507"
      ],
      "requires": [
        "cabinwright.tweaks>=1.4"
      ],
      "notes": "First release. Replaces the TCP ADB package."
    }
  ]
}
