{
  "id": "kia.store",
  "name": "App Store",
  "summary": "Get more apps for your car",
  "description": "Install, update and remove apps for your car.",
  "author": "hazptr",
  "homepage": "https://github.com/hazptr/kia-store",
  "icon": "https://raw.githubusercontent.com/hazptr/kia-store/4eae9f3a5f3db7bd18a908b99bc566f265aace9b/icon.png",
  "category": "tools",
  "versions": [
    {
      "version": "1.0",
      "url": "https://github.com/hazptr/kia-store/releases/download/v1.0/kia.store-v1.0.zip",
      "sha256": "6d9e34b3d292f04b378fc3fe7d00a133092143c93c18cacbcfc2edb679657cfb",
      "firmware": [
        "*"
      ],
      "notes": "First release."
    }
  ]
}
