{
  "id": "cabinwright.menu",
  "name": "Edit Menu",
  "summary": "Hide and reorder your home screen icons",
  "description": "Choose which icons show up on your home screen, and in what order.",
  "author": "hazptr",
  "homepage": "https://github.com/cabinwright/menu",
  "icon": "https://raw.githubusercontent.com/cabinwright/menu/5fc0c4e47de87acb9f7cd0a67f7c89a9dbba22d0/icon.png",
  "category": "tools",
  "versions": [
    {
      "version": "1.3",
      "url": "https://github.com/cabinwright/menu/releases/download/v1.3/cabinwright.menu-v1.3.zip",
      "sha256": "89e59a16c379bf863dd47967e0862ba213718470eb6dea997e4343d4e480ee35",
      "firmware": [
        "*"
      ],
      "notes": "The new home of Edit Menu. Takes over your menu layout from the earlier Edit Menu (cabinwright.menu)."
    }
  ]
}
